{
  "material_version": "0",
  "mode": "explicit_automation",
  "time_base": {
    "unit": "quarter_note_beat",
    "origin_beat": 0.0
  },
  "lanes": [
    {
      "lane_id": "A-MIX-GAIN",
      "target": {
        "parameter_id": "mix.gain",
        "scope": "project",
        "owner_id": null,
        "unit": "normalized",
        "minimum": 0.0,
        "maximum": 1.0
      },
      "section_id": null,
      "points": [
        {
          "point_id": "P-GAIN-001",
          "beat": 0.0,
          "value": 0.65,
          "interpolation": "linear"
        },
        {
          "point_id": "P-GAIN-002",
          "beat": 8.0,
          "value": 0.82,
          "interpolation": "hold"
        }
      ]
    },
    {
      "lane_id": "B-SYNTH-CUTOFF",
      "target": {
        "parameter_id": "synth.cutoff",
        "scope": "part",
        "owner_id": "P-SYNTH",
        "unit": "hertz",
        "minimum": 20.0,
        "maximum": 20000.0
      },
      "section_id": "S-INTRO",
      "points": [
        {
          "point_id": "P-CUTOFF-001",
          "beat": 0.0,
          "value": 800.0,
          "interpolation": "linear"
        },
        {
          "point_id": "P-CUTOFF-002",
          "beat": 4.0,
          "value": 2400.0,
          "interpolation": "hold"
        }
      ]
    }
  ]
}
